{
  "schema_version": "nexloop.context-pack.sim.v1",
  "world": "sim:3fa85f64-5717-4562-b3fc-2c963f66afa6",
  "tenant_id": "00000000-0000-4000-8000-000000000001",
  "consumer_id": "4f2c9a1e7b3d5f60812a4c6e8b0d2f4a6c8e0b2d4f6a8c0e2b4d6f8a0c2e4b6d",
  "data_mode": "simulation",
  "world_time": "2026-10-21T08:00:00.000000Z",
  "current_event": {"kind": "simulated_consumer_event", "event_id": "9b1d6e0c4a2f8e7d5c3b1a09f8e7d6c5b4a39281706f5e4d3c2b1a0f9e8d7c6b", "sequence": 2,
    "event_kind": "message", "provenance": "sim:event:9b1d6e0c4a2f8e7d5c3b1a09f8e7d6c5b4a39281706f5e4d3c2b1a0f9e8d7c6b", "source": "simulated"},
  "consumer_state": [
    {"subsection": "profile", "ref": "sim:object:4f2c9a1e7b3d5f60812a4c6e8b0d2f4a6c8e0b2d4f6a8c0e2b4d6f8a0c2e4b6d", "revision": "a1b2c3d4", "content": {"segment": "loyal", "joined_days_ago": 120},
     "content_hash": "0d1e2f3a4b5c6d7e8f90a1b2c3d4e5f60718293a4b5c6d7e8f9a0b1c2d3e4f50", "evidence_kind": "synthetic_profile", "source": "simulated", "at": "2026-10-21T08:00:00.000000Z", "tags": []}
  ],
  "evidence": [
    {"subsection": "simulated_conversation", "ref": "sim:event:9b1d6e0c4a2f8e7d5c3b1a09f8e7d6c5b4a39281706f5e4d3c2b1a0f9e8d7c6b", "revision": "2",
     "content": {"event_kind": "message", "text": "合成消息：请问明天上午还能预约吗？"}, "content_hash": "1d1e2f3a4b5c6d7e8f90a1b2c3d4e5f60718293a4b5c6d7e8f9a0b1c2d3e4f50",
     "evidence_kind": "simulated_input", "source": "simulated", "at": "2026-10-21T08:00:00.000000Z", "tags": ["latest_consumer_turn"]}
  ],
  "budget_report": {"event_limit": 20, "events_total": 2, "events_included": 1, "omitted": 1},
  "insufficient": [{"code": "older_events_omitted", "section": "evidence"}]
}
